{"arms":{"bounded_hybrid":{"artifact_sha256":"1a54815da5fa60b6b068492a52fed32b8d6f0980beaaafa5decdb9212af06b5e","fact_ids":["F04F66121E7F6","F0D13F626FF0E","F344F2CADA2C1","F3B0182019CC3","F4D3F54EB908A","F629FF0E81152","F6441EB7098B3","F695EC56665B5","F6D0EC3688AC6","F6E9940AE0B5A","F77CC9E269491","F79BCC74B5D65","F90E82C06C2E6","F9DDDCEEBA40E","F9E5C4CB702DA","FA42D8F247B9A","FA541ACD7B507","FB323130E5C00","FB55D11527F17","FD12FAE3AD9B0","FD2C022426212","FE43EFDBD11EB","FF043BF9866B3","FFD2188D583C3"],"fact_inventory_hash":"f43e4623a096fd0cbe2b52615c32640af764b5e2490d79409a59f438b599d091","location_map":{"F04F66121E7F6":{"text":{"end":2509,"kind":"utf8_span","start":2355},"visual":[{"kind":"image_primitive","primitive_id":"availability-4-0"}]},"F0D13F626FF0E":{"text":{"end":1612,"kind":"utf8_span","start":1461},"visual":[{"kind":"image_primitive","primitive_id":"availability-3-0"}]},"F344F2CADA2C1":{"text":{"end":3427,"kind":"utf8_span","start":3273},"visual":[{"kind":"image_primitive","primitive_id":"availability-6-0"}]},"F3B0182019CC3":{"text":{"end":1762,"kind":"utf8_span","start":1612},"visual":[{"kind":"image_primitive","primitive_id":"availability-3-2"}]},"F4D3F54EB908A":{"text":{"end":2057,"kind":"utf8_span","start":1908},"visual":[{"kind":"image_primitive","primitive_id":"availability-2-0"}]},"F629FF0E81152":{"text":{"end":3884,"kind":"utf8_span","start":3731},"visual":[{"kind":"image_primitive","primitive_id":"availability-7-0"}]},"F6441EB7098B3":{"text":{"end":3731,"kind":"utf8_span","start":3581},"visual":[{"kind":"image_primitive","primitive_id":"availability-7-1"}]},"F695EC56665B5":{"text":{"end":3273,"kind":"utf8_span","start":3122},"visual":[{"kind":"image_primitive","primitive_id":"availability-6-1"}]},"F6D0EC3688AC6":{"text":{"end":2355,"kind":"utf8_span","start":2204},"visual":[{"kind":"image_primitive","primitive_id":"availability-4-1"}]},"F6E9940AE0B5A":{"text":{"end":1166,"kind":"utf8_span","start":1017},"visual":[{"kind":"image_primitive","primitive_id":"availability-1-0"}]},"F77CC9E269491":{"text":{"end":2968,"kind":"utf8_span","start":2814},"visual":[{"kind":"image_primitive","primitive_id":"availability-5-0"}]},"F79BCC74B5D65":{"text":{"end":2814,"kind":"utf8_span","start":2663},"visual":[{"kind":"image_primitive","primitive_id":"availability-5-1"}]},"F90E82C06C2E6":{"text":{"end":1908,"kind":"utf8_span","start":1762},"visual":[{"kind":"image_primitive","primitive_id":"availability-2-1"}]},"F9DDDCEEBA40E":{"text":{"end":1017,"kind":"utf8_span","start":872},"visual":[{"kind":"image_primitive","primitive_id":"availability-1-1"}]},"F9E5C4CB702DA":{"text":{"end":724,"kind":"utf8_span","start":575},"visual":[{"kind":"image_primitive","primitive_id":"availability-0-0"}]},"FA42D8F247B9A":{"text":{"end":1461,"kind":"utf8_span","start":1314},"visual":[{"kind":"image_primitive","primitive_id":"availability-3-1"}]},"FA541ACD7B507":{"text":{"end":2204,"kind":"utf8_span","start":2057},"visual":[{"kind":"image_primitive","primitive_id":"availability-2-2"}]},"FB323130E5C00":{"text":{"end":1314,"kind":"utf8_span","start":1166},"visual":[{"kind":"image_primitive","primitive_id":"availability-1-2"}]},"FB55D11527F17":{"text":{"end":4037,"kind":"utf8_span","start":3884},"visual":[{"kind":"image_primitive","primitive_id":"availability-7-2"}]},"FD12FAE3AD9B0":{"text":{"end":3581,"kind":"utf8_span","start":3427},"visual":[{"kind":"image_primitive","primitive_id":"availability-6-2"}]},"FD2C022426212":{"text":{"end":872,"kind":"utf8_span","start":724},"visual":[{"kind":"image_primitive","primitive_id":"availability-0-2"}]},"FE43EFDBD11EB":{"text":{"end":2663,"kind":"utf8_span","start":2509},"visual":[{"kind":"image_primitive","primitive_id":"availability-4-2"}]},"FF043BF9866B3":{"text":{"end":575,"kind":"utf8_span","start":430},"visual":[{"kind":"image_primitive","primitive_id":"availability-0-1"}]},"FFD2188D583C3":{"text":{"end":3122,"kind":"utf8_span","start":2968},"visual":[{"kind":"image_primitive","primitive_id":"availability-5-2"}]}}},"text":{"artifact_sha256":"c1b60618a04977d4a59a8cc2b237d203eb219feff7407d7c09a40270924adc33","fact_ids":["F04F66121E7F6","F0D13F626FF0E","F344F2CADA2C1","F3B0182019CC3","F4D3F54EB908A","F629FF0E81152","F6441EB7098B3","F695EC56665B5","F6D0EC3688AC6","F6E9940AE0B5A","F77CC9E269491","F79BCC74B5D65","F90E82C06C2E6","F9DDDCEEBA40E","F9E5C4CB702DA","FA42D8F247B9A","FA541ACD7B507","FB323130E5C00","FB55D11527F17","FD12FAE3AD9B0","FD2C022426212","FE43EFDBD11EB","FF043BF9866B3","FFD2188D583C3"],"fact_inventory_hash":"f43e4623a096fd0cbe2b52615c32640af764b5e2490d79409a59f438b599d091","location_map":{"F04F66121E7F6":{"end":2509,"kind":"utf8_span","start":2355},"F0D13F626FF0E":{"end":1612,"kind":"utf8_span","start":1461},"F344F2CADA2C1":{"end":3427,"kind":"utf8_span","start":3273},"F3B0182019CC3":{"end":1762,"kind":"utf8_span","start":1612},"F4D3F54EB908A":{"end":2057,"kind":"utf8_span","start":1908},"F629FF0E81152":{"end":3884,"kind":"utf8_span","start":3731},"F6441EB7098B3":{"end":3731,"kind":"utf8_span","start":3581},"F695EC56665B5":{"end":3273,"kind":"utf8_span","start":3122},"F6D0EC3688AC6":{"end":2355,"kind":"utf8_span","start":2204},"F6E9940AE0B5A":{"end":1166,"kind":"utf8_span","start":1017},"F77CC9E269491":{"end":2968,"kind":"utf8_span","start":2814},"F79BCC74B5D65":{"end":2814,"kind":"utf8_span","start":2663},"F90E82C06C2E6":{"end":1908,"kind":"utf8_span","start":1762},"F9DDDCEEBA40E":{"end":1017,"kind":"utf8_span","start":872},"F9E5C4CB702DA":{"end":724,"kind":"utf8_span","start":575},"FA42D8F247B9A":{"end":1461,"kind":"utf8_span","start":1314},"FA541ACD7B507":{"end":2204,"kind":"utf8_span","start":2057},"FB323130E5C00":{"end":1314,"kind":"utf8_span","start":1166},"FB55D11527F17":{"end":4037,"kind":"utf8_span","start":3884},"FD12FAE3AD9B0":{"end":3581,"kind":"utf8_span","start":3427},"FD2C022426212":{"end":872,"kind":"utf8_span","start":724},"FE43EFDBD11EB":{"end":2663,"kind":"utf8_span","start":2509},"FF043BF9866B3":{"end":575,"kind":"utf8_span","start":430},"FFD2188D583C3":{"end":3122,"kind":"utf8_span","start":2968}}},"visual":{"artifact_sha256":"bad5c9e27c371f942902defd38debd8a248b5929995d0c56bb691f9b0dbdeba9","fact_ids":["F04F66121E7F6","F0D13F626FF0E","F344F2CADA2C1","F3B0182019CC3","F4D3F54EB908A","F629FF0E81152","F6441EB7098B3","F695EC56665B5","F6D0EC3688AC6","F6E9940AE0B5A","F77CC9E269491","F79BCC74B5D65","F90E82C06C2E6","F9DDDCEEBA40E","F9E5C4CB702DA","FA42D8F247B9A","FA541ACD7B507","FB323130E5C00","FB55D11527F17","FD12FAE3AD9B0","FD2C022426212","FE43EFDBD11EB","FF043BF9866B3","FFD2188D583C3"],"fact_inventory_hash":"f43e4623a096fd0cbe2b52615c32640af764b5e2490d79409a59f438b599d091","location_map":{"F04F66121E7F6":[{"kind":"image_primitive","primitive_id":"availability-4-0"}],"F0D13F626FF0E":[{"kind":"image_primitive","primitive_id":"availability-3-0"}],"F344F2CADA2C1":[{"kind":"image_primitive","primitive_id":"availability-6-0"}],"F3B0182019CC3":[{"kind":"image_primitive","primitive_id":"availability-3-2"}],"F4D3F54EB908A":[{"kind":"image_primitive","primitive_id":"availability-2-0"}],"F629FF0E81152":[{"kind":"image_primitive","primitive_id":"availability-7-0"}],"F6441EB7098B3":[{"kind":"image_primitive","primitive_id":"availability-7-1"}],"F695EC56665B5":[{"kind":"image_primitive","primitive_id":"availability-6-1"}],"F6D0EC3688AC6":[{"kind":"image_primitive","primitive_id":"availability-4-1"}],"F6E9940AE0B5A":[{"kind":"image_primitive","primitive_id":"availability-1-0"}],"F77CC9E269491":[{"kind":"image_primitive","primitive_id":"availability-5-0"}],"F79BCC74B5D65":[{"kind":"image_primitive","primitive_id":"availability-5-1"}],"F90E82C06C2E6":[{"kind":"image_primitive","primitive_id":"availability-2-1"}],"F9DDDCEEBA40E":[{"kind":"image_primitive","primitive_id":"availability-1-1"}],"F9E5C4CB702DA":[{"kind":"image_primitive","primitive_id":"availability-0-0"}],"FA42D8F247B9A":[{"kind":"image_primitive","primitive_id":"availability-3-1"}],"FA541ACD7B507":[{"kind":"image_primitive","primitive_id":"availability-2-2"}],"FB323130E5C00":[{"kind":"image_primitive","primitive_id":"availability-1-2"}],"FB55D11527F17":[{"kind":"image_primitive","primitive_id":"availability-7-2"}],"FD12FAE3AD9B0":[{"kind":"image_primitive","primitive_id":"availability-6-2"}],"FD2C022426212":[{"kind":"image_primitive","primitive_id":"availability-0-2"}],"FE43EFDBD11EB":[{"kind":"image_primitive","primitive_id":"availability-4-2"}],"FF043BF9866B3":[{"kind":"image_primitive","primitive_id":"availability-0-1"}],"FFD2188D583C3":[{"kind":"image_primitive","primitive_id":"availability-5-2"}]}}},"fact_count":24,"fact_inventory_hash":"f43e4623a096fd0cbe2b52615c32640af764b5e2490d79409a59f438b599d091","failures":[],"leakage_ok":true,"parity_ok":true,"prompt_composition":{"a_sha256":"ff0aa1b21ee02db9db3ff4a11abc2e6359a6780ea632998a13dd9c1b927dbda2","b_sha256":"be11b7b36adea843f9ddd61ad66df3a82deeae2b365d0028dd4f60239efa4d70","exact_part_concatenation":true,"hybrid_sha256":"1a54815da5fa60b6b068492a52fed32b8d6f0980beaaafa5decdb9212af06b5e","order":"A_PLUS_B"},"query_hash":"42d07c9cb67d8f1cc37912ba91a4ba88da86150d2d7dbb753bd29d512c23bde0","query_id":"Q-1DA76A9B09E968EB","schema_version":"PairedViewAuditV1"}
