{"arms":{"bounded_hybrid":{"artifact_sha256":"68854ef47ece06388d555bd76823d8fb33bc81852dab5d5f11755ae979a67399","fact_ids":["F0A6FAC048C87","F405010442C28","F5B62D08024A3","F75627A7335FC","FBC142F115169","FD90F6E2B3DBF","FF7FF674855E0"],"fact_inventory_hash":"a8a47ef85be15d9dfe1b942598c51a8488d3b01317637078baf29b5768fac913","location_map":{"F0A6FAC048C87":{"text":{"end":769,"kind":"utf8_span","start":603},"visual":[{"kind":"image_primitive","primitive_id":"metric-point-0-46"}]},"F405010442C28":{"text":{"end":603,"kind":"utf8_span","start":430},"visual":[{"kind":"image_primitive","primitive_id":"metric-point-0-46"}]},"F5B62D08024A3":{"text":{"end":1554,"kind":"utf8_span","start":1400},"visual":[{"kind":"image_primitive","primitive_id":"metric-point-0-46"}]},"F75627A7335FC":{"text":{"end":1400,"kind":"utf8_span","start":1228},"visual":[{"kind":"image_primitive","primitive_id":"metric-point-0-46"}]},"FBC142F115169":{"text":{"end":1228,"kind":"utf8_span","start":1077},"visual":[{"kind":"image_primitive","primitive_id":"metric-point-0-46"}]},"FD90F6E2B3DBF":{"text":{"end":1077,"kind":"utf8_span","start":923},"visual":[{"kind":"image_primitive","primitive_id":"metric-point-0-46"}]},"FF7FF674855E0":{"text":{"end":923,"kind":"utf8_span","start":769},"visual":[{"kind":"image_primitive","primitive_id":"metric-point-0-46"}]}}},"text":{"artifact_sha256":"2b8391d086077e516f8ffab62e80602ea4fa26e4c7d40fcc6c2f2ae0a6208432","fact_ids":["F0A6FAC048C87","F405010442C28","F5B62D08024A3","F75627A7335FC","FBC142F115169","FD90F6E2B3DBF","FF7FF674855E0"],"fact_inventory_hash":"a8a47ef85be15d9dfe1b942598c51a8488d3b01317637078baf29b5768fac913","location_map":{"F0A6FAC048C87":{"end":769,"kind":"utf8_span","start":603},"F405010442C28":{"end":603,"kind":"utf8_span","start":430},"F5B62D08024A3":{"end":1554,"kind":"utf8_span","start":1400},"F75627A7335FC":{"end":1400,"kind":"utf8_span","start":1228},"FBC142F115169":{"end":1228,"kind":"utf8_span","start":1077},"FD90F6E2B3DBF":{"end":1077,"kind":"utf8_span","start":923},"FF7FF674855E0":{"end":923,"kind":"utf8_span","start":769}}},"visual":{"artifact_sha256":"f834f02a16fdb09c71e5e680db446a148ae1c75818c175067021646a181aaa71","fact_ids":["F0A6FAC048C87","F405010442C28","F5B62D08024A3","F75627A7335FC","FBC142F115169","FD90F6E2B3DBF","FF7FF674855E0"],"fact_inventory_hash":"a8a47ef85be15d9dfe1b942598c51a8488d3b01317637078baf29b5768fac913","location_map":{"F0A6FAC048C87":[{"kind":"image_primitive","primitive_id":"metric-point-0-46"}],"F405010442C28":[{"kind":"image_primitive","primitive_id":"metric-point-0-46"}],"F5B62D08024A3":[{"kind":"image_primitive","primitive_id":"metric-point-0-46"}],"F75627A7335FC":[{"kind":"image_primitive","primitive_id":"metric-point-0-46"}],"FBC142F115169":[{"kind":"image_primitive","primitive_id":"metric-point-0-46"}],"FD90F6E2B3DBF":[{"kind":"image_primitive","primitive_id":"metric-point-0-46"}],"FF7FF674855E0":[{"kind":"image_primitive","primitive_id":"metric-point-0-46"}]}}},"fact_count":7,"fact_inventory_hash":"a8a47ef85be15d9dfe1b942598c51a8488d3b01317637078baf29b5768fac913","failures":[],"leakage_ok":true,"parity_ok":true,"prompt_composition":{"a_sha256":"cc7f13e9b0a2c6b018ed704f9e52e226c23d13930beedf2b906e5a0738627c48","b_sha256":"de96cde1b2822b922513a1fcacd74364fc04f606d4b250ea70973b89a58b319d","exact_part_concatenation":true,"hybrid_sha256":"68854ef47ece06388d555bd76823d8fb33bc81852dab5d5f11755ae979a67399","order":"A_PLUS_B"},"query_hash":"da012430a0f72181ad519834de84af552423f1f9645449543df8fcdf00b0b65f","query_id":"Q-DF0EBD554F3CB948","schema_version":"PairedViewAuditV1"}
