{"arms":{"bounded_hybrid":{"artifact_sha256":"3ecce37bda7a1f18f736f6e876fad10294256bc76c2cf37d378193e7a90c4b7b","fact_ids":["F03FA5F73E145","F09B9AF128A62","F30516A8A63FB","F30E23CF8F95C","F32645C023681","F5528D1C40D6C","F6E9940AE0B5A","F708ED3301834","F79989B127E91","F98EB9FDA6C56","F9DDDCEEBA40E","FB323130E5C00","FB6C0548238B0","FBF43B28C510D","FCB160872AB39","FD12FAE3AD9B0","FD2C022426212","FDA4BAD3CFE58","FDC77EEA4B693","FE49FEA772A37","FEF04218EA054","FEFB3E93AAF54","FF8A190D90DEB","FF956D7C7C378"],"fact_inventory_hash":"0cc7078d49b2e5e2d9b70f44b4d7ffd67211266d330f0b2644ccd68af0b638de","location_map":{"F03FA5F73E145":{"text":{"end":3402,"kind":"utf8_span","start":3242},"visual":[{"kind":"image_primitive","primitive_id":"availability-7-0"}]},"F09B9AF128A62":{"text":{"end":576,"kind":"utf8_span","start":430},"visual":[{"kind":"image_primitive","primitive_id":"availability-0-1"}]},"F30516A8A63FB":{"text":{"end":2506,"kind":"utf8_span","start":2359},"visual":[{"kind":"image_primitive","primitive_id":"availability-5-0"}]},"F30E23CF8F95C":{"text":{"end":4033,"kind":"utf8_span","start":3876},"visual":[{"kind":"image_primitive","primitive_id":"availability-6-2"}]},"F32645C023681":{"text":{"end":3242,"kind":"utf8_span","start":3085},"visual":[{"kind":"image_primitive","primitive_id":"availability-7-1"}]},"F5528D1C40D6C":{"text":{"end":3562,"kind":"utf8_span","start":3402},"visual":[{"kind":"image_primitive","primitive_id":"availability-7-2"}]},"F6E9940AE0B5A":{"text":{"end":1166,"kind":"utf8_span","start":1017},"visual":[{"kind":"image_primitive","primitive_id":"availability-1-0"}]},"F708ED3301834":{"text":{"end":2061,"kind":"utf8_span","start":1907},"visual":[{"kind":"image_primitive","primitive_id":"availability-3-0"}]},"F79989B127E91":{"text":{"end":2796,"kind":"utf8_span","start":2653},"visual":[{"kind":"image_primitive","primitive_id":"availability-4-1"}]},"F98EB9FDA6C56":{"text":{"end":1907,"kind":"utf8_span","start":1756},"visual":[{"kind":"image_primitive","primitive_id":"availability-3-1"}]},"F9DDDCEEBA40E":{"text":{"end":1017,"kind":"utf8_span","start":872},"visual":[{"kind":"image_primitive","primitive_id":"availability-1-1"}]},"FB323130E5C00":{"text":{"end":1314,"kind":"utf8_span","start":1166},"visual":[{"kind":"image_primitive","primitive_id":"availability-1-2"}]},"FB6C0548238B0":{"text":{"end":2941,"kind":"utf8_span","start":2796},"visual":[{"kind":"image_primitive","primitive_id":"availability-4-0"}]},"FBF43B28C510D":{"text":{"end":3085,"kind":"utf8_span","start":2941},"visual":[{"kind":"image_primitive","primitive_id":"availability-4-2"}]},"FCB160872AB39":{"text":{"end":1608,"kind":"utf8_span","start":1460},"visual":[{"kind":"image_primitive","primitive_id":"availability-2-0"}]},"FD12FAE3AD9B0":{"text":{"end":2215,"kind":"utf8_span","start":2061},"visual":[{"kind":"image_primitive","primitive_id":"availability-3-2"}]},"FD2C022426212":{"text":{"end":872,"kind":"utf8_span","start":724},"visual":[{"kind":"image_primitive","primitive_id":"availability-0-2"}]},"FDA4BAD3CFE58":{"text":{"end":2359,"kind":"utf8_span","start":2215},"visual":[{"kind":"image_primitive","primitive_id":"availability-5-1"}]},"FDC77EEA4B693":{"text":{"end":1756,"kind":"utf8_span","start":1608},"visual":[{"kind":"image_primitive","primitive_id":"availability-2-2"}]},"FE49FEA772A37":{"text":{"end":2653,"kind":"utf8_span","start":2506},"visual":[{"kind":"image_primitive","primitive_id":"availability-5-2"}]},"FEF04218EA054":{"text":{"end":1460,"kind":"utf8_span","start":1314},"visual":[{"kind":"image_primitive","primitive_id":"availability-2-1"}]},"FEFB3E93AAF54":{"text":{"end":3876,"kind":"utf8_span","start":3718},"visual":[{"kind":"image_primitive","primitive_id":"availability-6-0"}]},"FF8A190D90DEB":{"text":{"end":724,"kind":"utf8_span","start":576},"visual":[{"kind":"image_primitive","primitive_id":"availability-0-0"}]},"FF956D7C7C378":{"text":{"end":3718,"kind":"utf8_span","start":3562},"visual":[{"kind":"image_primitive","primitive_id":"availability-6-1"}]}}},"text":{"artifact_sha256":"ebeb95ff568cf6fd8da813455e68d3394597bce9fc49584d367a066bed742329","fact_ids":["F03FA5F73E145","F09B9AF128A62","F30516A8A63FB","F30E23CF8F95C","F32645C023681","F5528D1C40D6C","F6E9940AE0B5A","F708ED3301834","F79989B127E91","F98EB9FDA6C56","F9DDDCEEBA40E","FB323130E5C00","FB6C0548238B0","FBF43B28C510D","FCB160872AB39","FD12FAE3AD9B0","FD2C022426212","FDA4BAD3CFE58","FDC77EEA4B693","FE49FEA772A37","FEF04218EA054","FEFB3E93AAF54","FF8A190D90DEB","FF956D7C7C378"],"fact_inventory_hash":"0cc7078d49b2e5e2d9b70f44b4d7ffd67211266d330f0b2644ccd68af0b638de","location_map":{"F03FA5F73E145":{"end":3402,"kind":"utf8_span","start":3242},"F09B9AF128A62":{"end":576,"kind":"utf8_span","start":430},"F30516A8A63FB":{"end":2506,"kind":"utf8_span","start":2359},"F30E23CF8F95C":{"end":4033,"kind":"utf8_span","start":3876},"F32645C023681":{"end":3242,"kind":"utf8_span","start":3085},"F5528D1C40D6C":{"end":3562,"kind":"utf8_span","start":3402},"F6E9940AE0B5A":{"end":1166,"kind":"utf8_span","start":1017},"F708ED3301834":{"end":2061,"kind":"utf8_span","start":1907},"F79989B127E91":{"end":2796,"kind":"utf8_span","start":2653},"F98EB9FDA6C56":{"end":1907,"kind":"utf8_span","start":1756},"F9DDDCEEBA40E":{"end":1017,"kind":"utf8_span","start":872},"FB323130E5C00":{"end":1314,"kind":"utf8_span","start":1166},"FB6C0548238B0":{"end":2941,"kind":"utf8_span","start":2796},"FBF43B28C510D":{"end":3085,"kind":"utf8_span","start":2941},"FCB160872AB39":{"end":1608,"kind":"utf8_span","start":1460},"FD12FAE3AD9B0":{"end":2215,"kind":"utf8_span","start":2061},"FD2C022426212":{"end":872,"kind":"utf8_span","start":724},"FDA4BAD3CFE58":{"end":2359,"kind":"utf8_span","start":2215},"FDC77EEA4B693":{"end":1756,"kind":"utf8_span","start":1608},"FE49FEA772A37":{"end":2653,"kind":"utf8_span","start":2506},"FEF04218EA054":{"end":1460,"kind":"utf8_span","start":1314},"FEFB3E93AAF54":{"end":3876,"kind":"utf8_span","start":3718},"FF8A190D90DEB":{"end":724,"kind":"utf8_span","start":576},"FF956D7C7C378":{"end":3718,"kind":"utf8_span","start":3562}}},"visual":{"artifact_sha256":"944d96a697b0abf06c59b92d57c615091418108bd4ac18ac34a9d587725cc03c","fact_ids":["F03FA5F73E145","F09B9AF128A62","F30516A8A63FB","F30E23CF8F95C","F32645C023681","F5528D1C40D6C","F6E9940AE0B5A","F708ED3301834","F79989B127E91","F98EB9FDA6C56","F9DDDCEEBA40E","FB323130E5C00","FB6C0548238B0","FBF43B28C510D","FCB160872AB39","FD12FAE3AD9B0","FD2C022426212","FDA4BAD3CFE58","FDC77EEA4B693","FE49FEA772A37","FEF04218EA054","FEFB3E93AAF54","FF8A190D90DEB","FF956D7C7C378"],"fact_inventory_hash":"0cc7078d49b2e5e2d9b70f44b4d7ffd67211266d330f0b2644ccd68af0b638de","location_map":{"F03FA5F73E145":[{"kind":"image_primitive","primitive_id":"availability-7-0"}],"F09B9AF128A62":[{"kind":"image_primitive","primitive_id":"availability-0-1"}],"F30516A8A63FB":[{"kind":"image_primitive","primitive_id":"availability-5-0"}],"F30E23CF8F95C":[{"kind":"image_primitive","primitive_id":"availability-6-2"}],"F32645C023681":[{"kind":"image_primitive","primitive_id":"availability-7-1"}],"F5528D1C40D6C":[{"kind":"image_primitive","primitive_id":"availability-7-2"}],"F6E9940AE0B5A":[{"kind":"image_primitive","primitive_id":"availability-1-0"}],"F708ED3301834":[{"kind":"image_primitive","primitive_id":"availability-3-0"}],"F79989B127E91":[{"kind":"image_primitive","primitive_id":"availability-4-1"}],"F98EB9FDA6C56":[{"kind":"image_primitive","primitive_id":"availability-3-1"}],"F9DDDCEEBA40E":[{"kind":"image_primitive","primitive_id":"availability-1-1"}],"FB323130E5C00":[{"kind":"image_primitive","primitive_id":"availability-1-2"}],"FB6C0548238B0":[{"kind":"image_primitive","primitive_id":"availability-4-0"}],"FBF43B28C510D":[{"kind":"image_primitive","primitive_id":"availability-4-2"}],"FCB160872AB39":[{"kind":"image_primitive","primitive_id":"availability-2-0"}],"FD12FAE3AD9B0":[{"kind":"image_primitive","primitive_id":"availability-3-2"}],"FD2C022426212":[{"kind":"image_primitive","primitive_id":"availability-0-2"}],"FDA4BAD3CFE58":[{"kind":"image_primitive","primitive_id":"availability-5-1"}],"FDC77EEA4B693":[{"kind":"image_primitive","primitive_id":"availability-2-2"}],"FE49FEA772A37":[{"kind":"image_primitive","primitive_id":"availability-5-2"}],"FEF04218EA054":[{"kind":"image_primitive","primitive_id":"availability-2-1"}],"FEFB3E93AAF54":[{"kind":"image_primitive","primitive_id":"availability-6-0"}],"FF8A190D90DEB":[{"kind":"image_primitive","primitive_id":"availability-0-0"}],"FF956D7C7C378":[{"kind":"image_primitive","primitive_id":"availability-6-1"}]}}},"fact_count":24,"fact_inventory_hash":"0cc7078d49b2e5e2d9b70f44b4d7ffd67211266d330f0b2644ccd68af0b638de","failures":[],"leakage_ok":true,"parity_ok":true,"prompt_composition":{"a_sha256":"5d171e5060b2184b134245e52a37180ede5e00601f391d6d26155b41791f178a","b_sha256":"83255462cf640beb4ccb716206f0481d1a7bdce1c1ddfe86deeb96c1ee09a4f8","exact_part_concatenation":true,"hybrid_sha256":"3ecce37bda7a1f18f736f6e876fad10294256bc76c2cf37d378193e7a90c4b7b","order":"A_PLUS_B"},"query_hash":"35df6d1bfc928e4e6960d908fd94b37c6ed2ae586fd715cf9b8155557f5b8d02","query_id":"Q-D6C17A0DE163C8A1","schema_version":"PairedViewAuditV1"}
