{"arms":{"bounded_hybrid":{"artifact_sha256":"08bb443b2992cbcc1976bde39d3e4e8384edacda3b8057d269c481c2d8351d48","fact_ids":["F0D13F626FF0E","F1920A0DD2A3A","F1D46C64120C6","F207ABA94413A","F32FD7CECE7E2","F391FD36868E4","F39C307E89045","F4B8687663D1A","F6A55B46A4A7D","F6BBCAC90D877","F6E9940AE0B5A","F6F4C8C942B97","F76960C4AFCFC","F9D9EF479C325","F9DDDCEEBA40E","F9E5C4CB702DA","F9F9E175BFAEB","FB9C89DC212DB","FC7F8DC8612F3","FDFD59DCDEE02","FE2CCF3C6EE79","FE530508C7D5B","FF03F6069407E","FFAB95C21B0B7"],"fact_inventory_hash":"36486f0f29b1cbe628e4dbdee144795052eb8f2a960ae2214dd20353343ec4b9","location_map":{"F0D13F626FF0E":{"text":{"end":2051,"kind":"utf8_span","start":1900},"visual":[{"kind":"image_primitive","primitive_id":"availability-3-0"}]},"F1920A0DD2A3A":{"text":{"end":2794,"kind":"utf8_span","start":2647},"visual":[{"kind":"image_primitive","primitive_id":"availability-5-1"}]},"F1D46C64120C6":{"text":{"end":2647,"kind":"utf8_span","start":2498},"visual":[{"kind":"image_primitive","primitive_id":"availability-4-2"}]},"F207ABA94413A":{"text":{"end":1753,"kind":"utf8_span","start":1606},"visual":[{"kind":"image_primitive","primitive_id":"availability-2-2"}]},"F32FD7CECE7E2":{"text":{"end":2945,"kind":"utf8_span","start":2794},"visual":[{"kind":"image_primitive","primitive_id":"availability-5-0"}]},"F391FD36868E4":{"text":{"end":1312,"kind":"utf8_span","start":1165},"visual":[{"kind":"image_primitive","primitive_id":"availability-1-2"}]},"F39C307E89045":{"text":{"end":2200,"kind":"utf8_span","start":2051},"visual":[{"kind":"image_primitive","primitive_id":"availability-3-2"}]},"F4B8687663D1A":{"text":{"end":4002,"kind":"utf8_span","start":3852},"visual":[{"kind":"image_primitive","primitive_id":"availability-7-2"}]},"F6A55B46A4A7D":{"text":{"end":3245,"kind":"utf8_span","start":3094},"visual":[{"kind":"image_primitive","primitive_id":"availability-6-1"}]},"F6BBCAC90D877":{"text":{"end":3852,"kind":"utf8_span","start":3701},"visual":[{"kind":"image_primitive","primitive_id":"availability-7-0"}]},"F6E9940AE0B5A":{"text":{"end":1165,"kind":"utf8_span","start":1016},"visual":[{"kind":"image_primitive","primitive_id":"availability-1-0"}]},"F6F4C8C942B97":{"text":{"end":3094,"kind":"utf8_span","start":2945},"visual":[{"kind":"image_primitive","primitive_id":"availability-5-2"}]},"F76960C4AFCFC":{"text":{"end":3553,"kind":"utf8_span","start":3400},"visual":[{"kind":"image_primitive","primitive_id":"availability-6-2"}]},"F9D9EF479C325":{"text":{"end":2498,"kind":"utf8_span","start":2347},"visual":[{"kind":"image_primitive","primitive_id":"availability-4-0"}]},"F9DDDCEEBA40E":{"text":{"end":1016,"kind":"utf8_span","start":871},"visual":[{"kind":"image_primitive","primitive_id":"availability-1-1"}]},"F9E5C4CB702DA":{"text":{"end":724,"kind":"utf8_span","start":575},"visual":[{"kind":"image_primitive","primitive_id":"availability-0-0"}]},"F9F9E175BFAEB":{"text":{"end":2347,"kind":"utf8_span","start":2200},"visual":[{"kind":"image_primitive","primitive_id":"availability-4-1"}]},"FB9C89DC212DB":{"text":{"end":3400,"kind":"utf8_span","start":3245},"visual":[{"kind":"image_primitive","primitive_id":"availability-6-0"}]},"FC7F8DC8612F3":{"text":{"end":1606,"kind":"utf8_span","start":1457},"visual":[{"kind":"image_primitive","primitive_id":"availability-2-0"}]},"FDFD59DCDEE02":{"text":{"end":575,"kind":"utf8_span","start":430},"visual":[{"kind":"image_primitive","primitive_id":"availability-0-1"}]},"FE2CCF3C6EE79":{"text":{"end":3701,"kind":"utf8_span","start":3553},"visual":[{"kind":"image_primitive","primitive_id":"availability-7-1"}]},"FE530508C7D5B":{"text":{"end":871,"kind":"utf8_span","start":724},"visual":[{"kind":"image_primitive","primitive_id":"availability-0-2"}]},"FF03F6069407E":{"text":{"end":1457,"kind":"utf8_span","start":1312},"visual":[{"kind":"image_primitive","primitive_id":"availability-2-1"}]},"FFAB95C21B0B7":{"text":{"end":1900,"kind":"utf8_span","start":1753},"visual":[{"kind":"image_primitive","primitive_id":"availability-3-1"}]}}},"text":{"artifact_sha256":"9132d04dd7131c47a626f859773d19d0d0500ec1bfa0ff1549995783cc9813a2","fact_ids":["F0D13F626FF0E","F1920A0DD2A3A","F1D46C64120C6","F207ABA94413A","F32FD7CECE7E2","F391FD36868E4","F39C307E89045","F4B8687663D1A","F6A55B46A4A7D","F6BBCAC90D877","F6E9940AE0B5A","F6F4C8C942B97","F76960C4AFCFC","F9D9EF479C325","F9DDDCEEBA40E","F9E5C4CB702DA","F9F9E175BFAEB","FB9C89DC212DB","FC7F8DC8612F3","FDFD59DCDEE02","FE2CCF3C6EE79","FE530508C7D5B","FF03F6069407E","FFAB95C21B0B7"],"fact_inventory_hash":"36486f0f29b1cbe628e4dbdee144795052eb8f2a960ae2214dd20353343ec4b9","location_map":{"F0D13F626FF0E":{"end":2051,"kind":"utf8_span","start":1900},"F1920A0DD2A3A":{"end":2794,"kind":"utf8_span","start":2647},"F1D46C64120C6":{"end":2647,"kind":"utf8_span","start":2498},"F207ABA94413A":{"end":1753,"kind":"utf8_span","start":1606},"F32FD7CECE7E2":{"end":2945,"kind":"utf8_span","start":2794},"F391FD36868E4":{"end":1312,"kind":"utf8_span","start":1165},"F39C307E89045":{"end":2200,"kind":"utf8_span","start":2051},"F4B8687663D1A":{"end":4002,"kind":"utf8_span","start":3852},"F6A55B46A4A7D":{"end":3245,"kind":"utf8_span","start":3094},"F6BBCAC90D877":{"end":3852,"kind":"utf8_span","start":3701},"F6E9940AE0B5A":{"end":1165,"kind":"utf8_span","start":1016},"F6F4C8C942B97":{"end":3094,"kind":"utf8_span","start":2945},"F76960C4AFCFC":{"end":3553,"kind":"utf8_span","start":3400},"F9D9EF479C325":{"end":2498,"kind":"utf8_span","start":2347},"F9DDDCEEBA40E":{"end":1016,"kind":"utf8_span","start":871},"F9E5C4CB702DA":{"end":724,"kind":"utf8_span","start":575},"F9F9E175BFAEB":{"end":2347,"kind":"utf8_span","start":2200},"FB9C89DC212DB":{"end":3400,"kind":"utf8_span","start":3245},"FC7F8DC8612F3":{"end":1606,"kind":"utf8_span","start":1457},"FDFD59DCDEE02":{"end":575,"kind":"utf8_span","start":430},"FE2CCF3C6EE79":{"end":3701,"kind":"utf8_span","start":3553},"FE530508C7D5B":{"end":871,"kind":"utf8_span","start":724},"FF03F6069407E":{"end":1457,"kind":"utf8_span","start":1312},"FFAB95C21B0B7":{"end":1900,"kind":"utf8_span","start":1753}}},"visual":{"artifact_sha256":"7b79c2653a778479c12a91ab301944b8afea384275f3e4dc28ca8a9ee685ba2e","fact_ids":["F0D13F626FF0E","F1920A0DD2A3A","F1D46C64120C6","F207ABA94413A","F32FD7CECE7E2","F391FD36868E4","F39C307E89045","F4B8687663D1A","F6A55B46A4A7D","F6BBCAC90D877","F6E9940AE0B5A","F6F4C8C942B97","F76960C4AFCFC","F9D9EF479C325","F9DDDCEEBA40E","F9E5C4CB702DA","F9F9E175BFAEB","FB9C89DC212DB","FC7F8DC8612F3","FDFD59DCDEE02","FE2CCF3C6EE79","FE530508C7D5B","FF03F6069407E","FFAB95C21B0B7"],"fact_inventory_hash":"36486f0f29b1cbe628e4dbdee144795052eb8f2a960ae2214dd20353343ec4b9","location_map":{"F0D13F626FF0E":[{"kind":"image_primitive","primitive_id":"availability-3-0"}],"F1920A0DD2A3A":[{"kind":"image_primitive","primitive_id":"availability-5-1"}],"F1D46C64120C6":[{"kind":"image_primitive","primitive_id":"availability-4-2"}],"F207ABA94413A":[{"kind":"image_primitive","primitive_id":"availability-2-2"}],"F32FD7CECE7E2":[{"kind":"image_primitive","primitive_id":"availability-5-0"}],"F391FD36868E4":[{"kind":"image_primitive","primitive_id":"availability-1-2"}],"F39C307E89045":[{"kind":"image_primitive","primitive_id":"availability-3-2"}],"F4B8687663D1A":[{"kind":"image_primitive","primitive_id":"availability-7-2"}],"F6A55B46A4A7D":[{"kind":"image_primitive","primitive_id":"availability-6-1"}],"F6BBCAC90D877":[{"kind":"image_primitive","primitive_id":"availability-7-0"}],"F6E9940AE0B5A":[{"kind":"image_primitive","primitive_id":"availability-1-0"}],"F6F4C8C942B97":[{"kind":"image_primitive","primitive_id":"availability-5-2"}],"F76960C4AFCFC":[{"kind":"image_primitive","primitive_id":"availability-6-2"}],"F9D9EF479C325":[{"kind":"image_primitive","primitive_id":"availability-4-0"}],"F9DDDCEEBA40E":[{"kind":"image_primitive","primitive_id":"availability-1-1"}],"F9E5C4CB702DA":[{"kind":"image_primitive","primitive_id":"availability-0-0"}],"F9F9E175BFAEB":[{"kind":"image_primitive","primitive_id":"availability-4-1"}],"FB9C89DC212DB":[{"kind":"image_primitive","primitive_id":"availability-6-0"}],"FC7F8DC8612F3":[{"kind":"image_primitive","primitive_id":"availability-2-0"}],"FDFD59DCDEE02":[{"kind":"image_primitive","primitive_id":"availability-0-1"}],"FE2CCF3C6EE79":[{"kind":"image_primitive","primitive_id":"availability-7-1"}],"FE530508C7D5B":[{"kind":"image_primitive","primitive_id":"availability-0-2"}],"FF03F6069407E":[{"kind":"image_primitive","primitive_id":"availability-2-1"}],"FFAB95C21B0B7":[{"kind":"image_primitive","primitive_id":"availability-3-1"}]}}},"fact_count":24,"fact_inventory_hash":"36486f0f29b1cbe628e4dbdee144795052eb8f2a960ae2214dd20353343ec4b9","failures":[],"leakage_ok":true,"parity_ok":true,"prompt_composition":{"a_sha256":"1dc7676c8ea280b74c13731eb605a923319e880b32678e764632fb91d74d05f9","b_sha256":"8bb0a23b360af999214c2cb4b2d8fd8452d2f306f53f51677233e0a95ba61448","exact_part_concatenation":true,"hybrid_sha256":"08bb443b2992cbcc1976bde39d3e4e8384edacda3b8057d269c481c2d8351d48","order":"A_PLUS_B"},"query_hash":"90b9164a80db5921faf406fcc465972bf58b53a40177a44632e2b494292e773e","query_id":"Q-92D7422C5F62752C","schema_version":"PairedViewAuditV1"}
