{"arms":{"bounded_hybrid":{"artifact_sha256":"7a62c4bf0f2a7c73d8fb977926383767331508fb825d155afbbd55f2950c91e7","fact_ids":["F20AEE5EC1EE5","F437147CE0615","F66937405B85F","F692CEF0B8E8A","F6B0EB5A9B0F6","F7B8A3B405554","F7EB499ACA019","F94E15B67B268","F95264A052952","FABF07CE43A9A","FCCFD38ED9AF3","FCD6510B3E09F","FDABAEE16C7BA","FE5D362C801EE","FE722CEC83CD3","FFE91E228E272"],"fact_inventory_hash":"aedbf518752fee0dab9cf1d863c3370fb8f1943c0b934cf6f0f059a71bd5c8f0","location_map":{"F20AEE5EC1EE5":{"text":{"end":1630,"kind":"utf8_span","start":1486},"visual":[{"kind":"image_primitive","primitive_id":"temporal-2"}]},"F437147CE0615":{"text":{"end":1486,"kind":"utf8_span","start":1333},"visual":[{"kind":"image_primitive","primitive_id":"temporal-2"}]},"F66937405B85F":{"text":{"end":1809,"kind":"utf8_span","start":1630},"visual":[{"kind":"image_primitive","primitive_id":"temporal-3"}]},"F692CEF0B8E8A":{"text":{"end":1945,"kind":"utf8_span","start":1809},"visual":[{"kind":"image_primitive","primitive_id":"temporal-3"}]},"F6B0EB5A9B0F6":{"text":{"end":2688,"kind":"utf8_span","start":2535},"visual":[{"kind":"image_primitive","primitive_id":"temporal-5"}]},"F7B8A3B405554":{"text":{"end":2239,"kind":"utf8_span","start":2097},"visual":[{"kind":"image_primitive","primitive_id":"temporal-3"}]},"F7EB499ACA019":{"text":{"end":2535,"kind":"utf8_span","start":2398},"visual":[{"kind":"image_primitive","primitive_id":"temporal-5"}]},"F94E15B67B268":{"text":{"end":1045,"kind":"utf8_span","start":899},"visual":[{"kind":"image_primitive","primitive_id":"temporal-0"}]},"F95264A052952":{"text":{"end":1196,"kind":"utf8_span","start":1045},"visual":[{"kind":"image_primitive","primitive_id":"temporal-2"}]},"FABF07CE43A9A":{"text":{"end":607,"kind":"utf8_span","start":430},"visual":[{"kind":"image_primitive","primitive_id":"temporal-0"}]},"FCCFD38ED9AF3":{"text":{"end":1333,"kind":"utf8_span","start":1196},"visual":[{"kind":"image_primitive","primitive_id":"temporal-2"}]},"FCD6510B3E09F":{"text":{"end":745,"kind":"utf8_span","start":607},"visual":[{"kind":"image_primitive","primitive_id":"temporal-0"}]},"FDABAEE16C7BA":{"text":{"end":2832,"kind":"utf8_span","start":2688},"visual":[{"kind":"image_primitive","primitive_id":"temporal-5"}]},"FE5D362C801EE":{"text":{"end":899,"kind":"utf8_span","start":745},"visual":[{"kind":"image_primitive","primitive_id":"temporal-0"}]},"FE722CEC83CD3":{"text":{"end":2097,"kind":"utf8_span","start":1945},"visual":[{"kind":"image_primitive","primitive_id":"temporal-3"}]},"FFE91E228E272":{"text":{"end":2398,"kind":"utf8_span","start":2239},"visual":[{"kind":"image_primitive","primitive_id":"temporal-5"}]}}},"text":{"artifact_sha256":"05e7f035eba5a241bf3b3de254976695603dfd69af81f40e5087f9280e29f2ae","fact_ids":["F20AEE5EC1EE5","F437147CE0615","F66937405B85F","F692CEF0B8E8A","F6B0EB5A9B0F6","F7B8A3B405554","F7EB499ACA019","F94E15B67B268","F95264A052952","FABF07CE43A9A","FCCFD38ED9AF3","FCD6510B3E09F","FDABAEE16C7BA","FE5D362C801EE","FE722CEC83CD3","FFE91E228E272"],"fact_inventory_hash":"aedbf518752fee0dab9cf1d863c3370fb8f1943c0b934cf6f0f059a71bd5c8f0","location_map":{"F20AEE5EC1EE5":{"end":1630,"kind":"utf8_span","start":1486},"F437147CE0615":{"end":1486,"kind":"utf8_span","start":1333},"F66937405B85F":{"end":1809,"kind":"utf8_span","start":1630},"F692CEF0B8E8A":{"end":1945,"kind":"utf8_span","start":1809},"F6B0EB5A9B0F6":{"end":2688,"kind":"utf8_span","start":2535},"F7B8A3B405554":{"end":2239,"kind":"utf8_span","start":2097},"F7EB499ACA019":{"end":2535,"kind":"utf8_span","start":2398},"F94E15B67B268":{"end":1045,"kind":"utf8_span","start":899},"F95264A052952":{"end":1196,"kind":"utf8_span","start":1045},"FABF07CE43A9A":{"end":607,"kind":"utf8_span","start":430},"FCCFD38ED9AF3":{"end":1333,"kind":"utf8_span","start":1196},"FCD6510B3E09F":{"end":745,"kind":"utf8_span","start":607},"FDABAEE16C7BA":{"end":2832,"kind":"utf8_span","start":2688},"FE5D362C801EE":{"end":899,"kind":"utf8_span","start":745},"FE722CEC83CD3":{"end":2097,"kind":"utf8_span","start":1945},"FFE91E228E272":{"end":2398,"kind":"utf8_span","start":2239}}},"visual":{"artifact_sha256":"f9f23c07968f14a901ebb50f071a4adf5eb8b03f86335836533bd6dbc35ed31c","fact_ids":["F20AEE5EC1EE5","F437147CE0615","F66937405B85F","F692CEF0B8E8A","F6B0EB5A9B0F6","F7B8A3B405554","F7EB499ACA019","F94E15B67B268","F95264A052952","FABF07CE43A9A","FCCFD38ED9AF3","FCD6510B3E09F","FDABAEE16C7BA","FE5D362C801EE","FE722CEC83CD3","FFE91E228E272"],"fact_inventory_hash":"aedbf518752fee0dab9cf1d863c3370fb8f1943c0b934cf6f0f059a71bd5c8f0","location_map":{"F20AEE5EC1EE5":[{"kind":"image_primitive","primitive_id":"temporal-2"}],"F437147CE0615":[{"kind":"image_primitive","primitive_id":"temporal-2"}],"F66937405B85F":[{"kind":"image_primitive","primitive_id":"temporal-3"}],"F692CEF0B8E8A":[{"kind":"image_primitive","primitive_id":"temporal-3"}],"F6B0EB5A9B0F6":[{"kind":"image_primitive","primitive_id":"temporal-5"}],"F7B8A3B405554":[{"kind":"image_primitive","primitive_id":"temporal-3"}],"F7EB499ACA019":[{"kind":"image_primitive","primitive_id":"temporal-5"}],"F94E15B67B268":[{"kind":"image_primitive","primitive_id":"temporal-0"}],"F95264A052952":[{"kind":"image_primitive","primitive_id":"temporal-2"}],"FABF07CE43A9A":[{"kind":"image_primitive","primitive_id":"temporal-0"}],"FCCFD38ED9AF3":[{"kind":"image_primitive","primitive_id":"temporal-2"}],"FCD6510B3E09F":[{"kind":"image_primitive","primitive_id":"temporal-0"}],"FDABAEE16C7BA":[{"kind":"image_primitive","primitive_id":"temporal-5"}],"FE5D362C801EE":[{"kind":"image_primitive","primitive_id":"temporal-0"}],"FE722CEC83CD3":[{"kind":"image_primitive","primitive_id":"temporal-3"}],"FFE91E228E272":[{"kind":"image_primitive","primitive_id":"temporal-5"}]}}},"fact_count":16,"fact_inventory_hash":"aedbf518752fee0dab9cf1d863c3370fb8f1943c0b934cf6f0f059a71bd5c8f0","failures":[],"leakage_ok":true,"parity_ok":true,"prompt_composition":{"a_sha256":"051920537ab956700aefcc0723c0d56609126c0b9d2963ada4bc50584475549f","b_sha256":"8c48f70ffd6411eac94d5b44b27e056e202494de7dc8d9f66092b587ad11d13c","exact_part_concatenation":true,"hybrid_sha256":"7a62c4bf0f2a7c73d8fb977926383767331508fb825d155afbbd55f2950c91e7","order":"A_PLUS_B"},"query_hash":"5a03719ee90cd7a2609fa93720665e57d1f2e66832cd3fd3171cee336f7f6f22","query_id":"Q-C650D25C1D48C311","schema_version":"PairedViewAuditV1"}
