{"arms":{"bounded_hybrid":{"artifact_sha256":"ad2e3b3ea4e3d095a71abc7b9533746288b0f12242717db3d37fa3d0fc587ae5","fact_ids":["F080BEC64EBBB","F1097EE5EF297","F21BC150284A4","F4CE6D7749837","F4E8CFA6409B4","FC073817ECCAE","FC6EE2297DEE8","FD9C68BC98D26"],"fact_inventory_hash":"b00ddbfdfb90ce8a2aa759dc5473efc3dabb727c54b0b66657db58e529d4ac4f","location_map":{"F080BEC64EBBB":{"text":{"end":3066,"kind":"utf8_span","start":2739},"visual":[{"kind":"image_primitive","primitive_id":"edge-ts-ui-dashboard-ts-food-service"}]},"F1097EE5EF297":{"text":{"end":755,"kind":"utf8_span","start":430},"visual":[{"kind":"image_primitive","primitive_id":"edge-loadgenerator-ts-ui-dashboard"}]},"F21BC150284A4":{"text":{"end":1090,"kind":"utf8_span","start":755},"visual":[{"kind":"image_primitive","primitive_id":"edge-ts-preserve-service-ts-contacts-service"}]},"F4CE6D7749837":{"text":{"end":1749,"kind":"utf8_span","start":1422},"visual":[{"kind":"image_primitive","primitive_id":"edge-ts-ui-dashboard-ts-auth-service"}]},"F4E8CFA6409B4":{"text":{"end":1422,"kind":"utf8_span","start":1090},"visual":[{"kind":"image_primitive","primitive_id":"edge-ts-ui-dashboard-ts-assurance-service"}]},"FC073817ECCAE":{"text":{"end":2739,"kind":"utf8_span","start":2408},"visual":[{"kind":"image_primitive","primitive_id":"edge-ts-ui-dashboard-ts-contacts-service"}]},"FC6EE2297DEE8":{"text":{"end":2078,"kind":"utf8_span","start":1749},"visual":[{"kind":"image_primitive","primitive_id":"edge-ts-ui-dashboard-ts-cancel-service"}]},"FD9C68BC98D26":{"text":{"end":2408,"kind":"utf8_span","start":2078},"visual":[{"kind":"image_primitive","primitive_id":"edge-ts-ui-dashboard-ts-consign-service"}]}}},"text":{"artifact_sha256":"9e03ed3d327c7e1a5a2a6f4ceff35ddd6c25aeac8037ced9c60fc204834a01a6","fact_ids":["F080BEC64EBBB","F1097EE5EF297","F21BC150284A4","F4CE6D7749837","F4E8CFA6409B4","FC073817ECCAE","FC6EE2297DEE8","FD9C68BC98D26"],"fact_inventory_hash":"b00ddbfdfb90ce8a2aa759dc5473efc3dabb727c54b0b66657db58e529d4ac4f","location_map":{"F080BEC64EBBB":{"end":3066,"kind":"utf8_span","start":2739},"F1097EE5EF297":{"end":755,"kind":"utf8_span","start":430},"F21BC150284A4":{"end":1090,"kind":"utf8_span","start":755},"F4CE6D7749837":{"end":1749,"kind":"utf8_span","start":1422},"F4E8CFA6409B4":{"end":1422,"kind":"utf8_span","start":1090},"FC073817ECCAE":{"end":2739,"kind":"utf8_span","start":2408},"FC6EE2297DEE8":{"end":2078,"kind":"utf8_span","start":1749},"FD9C68BC98D26":{"end":2408,"kind":"utf8_span","start":2078}}},"visual":{"artifact_sha256":"d3cd5bd7ffc54126212ef4672502d32c368f571cf3c5df8f26cc65e682d26bb2","fact_ids":["F080BEC64EBBB","F1097EE5EF297","F21BC150284A4","F4CE6D7749837","F4E8CFA6409B4","FC073817ECCAE","FC6EE2297DEE8","FD9C68BC98D26"],"fact_inventory_hash":"b00ddbfdfb90ce8a2aa759dc5473efc3dabb727c54b0b66657db58e529d4ac4f","location_map":{"F080BEC64EBBB":[{"kind":"image_primitive","primitive_id":"edge-ts-ui-dashboard-ts-food-service"}],"F1097EE5EF297":[{"kind":"image_primitive","primitive_id":"edge-loadgenerator-ts-ui-dashboard"}],"F21BC150284A4":[{"kind":"image_primitive","primitive_id":"edge-ts-preserve-service-ts-contacts-service"}],"F4CE6D7749837":[{"kind":"image_primitive","primitive_id":"edge-ts-ui-dashboard-ts-auth-service"}],"F4E8CFA6409B4":[{"kind":"image_primitive","primitive_id":"edge-ts-ui-dashboard-ts-assurance-service"}],"FC073817ECCAE":[{"kind":"image_primitive","primitive_id":"edge-ts-ui-dashboard-ts-contacts-service"}],"FC6EE2297DEE8":[{"kind":"image_primitive","primitive_id":"edge-ts-ui-dashboard-ts-cancel-service"}],"FD9C68BC98D26":[{"kind":"image_primitive","primitive_id":"edge-ts-ui-dashboard-ts-consign-service"}]}}},"fact_count":8,"fact_inventory_hash":"b00ddbfdfb90ce8a2aa759dc5473efc3dabb727c54b0b66657db58e529d4ac4f","failures":[],"leakage_ok":true,"parity_ok":true,"prompt_composition":{"a_sha256":"29ded72775e53cac9659864878dd1cc7b1dca63cfaa1d102e08010d07f428950","b_sha256":"86612f335f2a5782a3c45efeb0691d2446729f93ee63120ebd75eb0b173ba2ea","exact_part_concatenation":true,"hybrid_sha256":"ad2e3b3ea4e3d095a71abc7b9533746288b0f12242717db3d37fa3d0fc587ae5","order":"A_PLUS_B"},"query_hash":"1efbc6ac93552ba86ff8b8b5778c3df4b868d8e201cfff3a7ada2c12e738b8b1","query_id":"Q-9312100036F63BAF","schema_version":"PairedViewAuditV1"}
