{"arms":{"bounded_hybrid":{"artifact_sha256":"c3f341413330d548c6ca22a08956dd775a3b2f3d427721227044fa19abf9c246","fact_ids":["F1097EE5EF297","F29EF46014059","F2F9FCE1320A0","F85F8D3B0065D","F8E38CEFE1F8C","FA2CDBE0FCD83","FA80F02D12921","FAC63327CCAFA","FB8A4DE176716","FBA9024B2B8A2","FE70BB5BE5829"],"fact_inventory_hash":"6b68e2a8a05609c3f3c2028cf83f3ad6ea8b76edea0ca9ecb13ad04a045dd864","location_map":{"F1097EE5EF297":{"text":{"end":1131,"kind":"utf8_span","start":804},"visual":[{"kind":"image_primitive","primitive_id":"edge-checkoutservice-0-cartservice-0"}]},"F29EF46014059":{"text":{"end":1788,"kind":"utf8_span","start":1458},"visual":[{"kind":"image_primitive","primitive_id":"edge-checkoutservice-0-paymentservice-1"}]},"F2F9FCE1320A0":{"text":{"end":2424,"kind":"utf8_span","start":2106},"visual":[{"kind":"image_primitive","primitive_id":"edge-frontend-2-adservice-1"}]},"F85F8D3B0065D":{"text":{"end":1458,"kind":"utf8_span","start":1131},"visual":[{"kind":"image_primitive","primitive_id":"edge-checkoutservice-0-cartservice-1"}]},"F8E38CEFE1F8C":{"text":{"end":2106,"kind":"utf8_span","start":1788},"visual":[{"kind":"image_primitive","primitive_id":"edge-frontend-2-adservice-0"}]},"FA2CDBE0FCD83":{"text":{"end":2742,"kind":"utf8_span","start":2424},"visual":[{"kind":"image_primitive","primitive_id":"edge-frontend-2-adservice-2"}]},"FA80F02D12921":{"text":{"end":3706,"kind":"utf8_span","start":3382},"visual":[{"kind":"image_primitive","primitive_id":"edge-frontend-2-checkoutservice-0"}]},"FAC63327CCAFA":{"text":{"end":804,"kind":"utf8_span","start":430},"visual":[{"kind":"image_primitive","primitive_id":"path-FAC63327CCAFA"}]},"FB8A4DE176716":{"text":{"end":4034,"kind":"utf8_span","start":3706},"visual":[{"kind":"image_primitive","primitive_id":"edge-checkoutservice-0-emailservice-2"}]},"FBA9024B2B8A2":{"text":{"end":3062,"kind":"utf8_span","start":2742},"visual":[{"kind":"image_primitive","primitive_id":"edge-frontend-2-cartservice-0"}]},"FE70BB5BE5829":{"text":{"end":3382,"kind":"utf8_span","start":3062},"visual":[{"kind":"image_primitive","primitive_id":"edge-frontend-2-cartservice-1"}]}}},"text":{"artifact_sha256":"5d85821784490370e855a832235863dfbbf301c279a83c87996eb80563665a48","fact_ids":["F1097EE5EF297","F29EF46014059","F2F9FCE1320A0","F85F8D3B0065D","F8E38CEFE1F8C","FA2CDBE0FCD83","FA80F02D12921","FAC63327CCAFA","FB8A4DE176716","FBA9024B2B8A2","FE70BB5BE5829"],"fact_inventory_hash":"6b68e2a8a05609c3f3c2028cf83f3ad6ea8b76edea0ca9ecb13ad04a045dd864","location_map":{"F1097EE5EF297":{"end":1131,"kind":"utf8_span","start":804},"F29EF46014059":{"end":1788,"kind":"utf8_span","start":1458},"F2F9FCE1320A0":{"end":2424,"kind":"utf8_span","start":2106},"F85F8D3B0065D":{"end":1458,"kind":"utf8_span","start":1131},"F8E38CEFE1F8C":{"end":2106,"kind":"utf8_span","start":1788},"FA2CDBE0FCD83":{"end":2742,"kind":"utf8_span","start":2424},"FA80F02D12921":{"end":3706,"kind":"utf8_span","start":3382},"FAC63327CCAFA":{"end":804,"kind":"utf8_span","start":430},"FB8A4DE176716":{"end":4034,"kind":"utf8_span","start":3706},"FBA9024B2B8A2":{"end":3062,"kind":"utf8_span","start":2742},"FE70BB5BE5829":{"end":3382,"kind":"utf8_span","start":3062}}},"visual":{"artifact_sha256":"98ddae891b5e885e58a011aefaeb9e1e4073a087b75418af725c1886e5e5fe51","fact_ids":["F1097EE5EF297","F29EF46014059","F2F9FCE1320A0","F85F8D3B0065D","F8E38CEFE1F8C","FA2CDBE0FCD83","FA80F02D12921","FAC63327CCAFA","FB8A4DE176716","FBA9024B2B8A2","FE70BB5BE5829"],"fact_inventory_hash":"6b68e2a8a05609c3f3c2028cf83f3ad6ea8b76edea0ca9ecb13ad04a045dd864","location_map":{"F1097EE5EF297":[{"kind":"image_primitive","primitive_id":"edge-checkoutservice-0-cartservice-0"}],"F29EF46014059":[{"kind":"image_primitive","primitive_id":"edge-checkoutservice-0-paymentservice-1"}],"F2F9FCE1320A0":[{"kind":"image_primitive","primitive_id":"edge-frontend-2-adservice-1"}],"F85F8D3B0065D":[{"kind":"image_primitive","primitive_id":"edge-checkoutservice-0-cartservice-1"}],"F8E38CEFE1F8C":[{"kind":"image_primitive","primitive_id":"edge-frontend-2-adservice-0"}],"FA2CDBE0FCD83":[{"kind":"image_primitive","primitive_id":"edge-frontend-2-adservice-2"}],"FA80F02D12921":[{"kind":"image_primitive","primitive_id":"edge-frontend-2-checkoutservice-0"}],"FAC63327CCAFA":[{"kind":"image_primitive","primitive_id":"path-FAC63327CCAFA"}],"FB8A4DE176716":[{"kind":"image_primitive","primitive_id":"edge-checkoutservice-0-emailservice-2"}],"FBA9024B2B8A2":[{"kind":"image_primitive","primitive_id":"edge-frontend-2-cartservice-0"}],"FE70BB5BE5829":[{"kind":"image_primitive","primitive_id":"edge-frontend-2-cartservice-1"}]}}},"fact_count":11,"fact_inventory_hash":"6b68e2a8a05609c3f3c2028cf83f3ad6ea8b76edea0ca9ecb13ad04a045dd864","failures":[],"leakage_ok":true,"parity_ok":true,"prompt_composition":{"a_sha256":"6c408811ada90576e2d373f5afa38c63aa24ebeae0ae2c1bdda405ebf3002e11","b_sha256":"4403acbfa876b49d0976e31645676b33a02a4cda7217b5815e0854b3e03b9691","exact_part_concatenation":true,"hybrid_sha256":"c3f341413330d548c6ca22a08956dd775a3b2f3d427721227044fa19abf9c246","order":"A_PLUS_B"},"query_hash":"903d872ad0bfd466f07f6eaae3d4ac864be9e1d20ea11eb00fcff03db6f96d46","query_id":"Q-9639968B9C5DF17C","schema_version":"PairedViewAuditV1"}
