{"arms":{"bounded_hybrid":{"artifact_sha256":"209d544d539225122b8a51fd6c8a68cecbe60963a7fef588e72564b4bbca5dbe","fact_ids":["F36561BC1509E","F380F1144B7BD","F7F3708927892","F96789C510925","FBB2A339E6F82","FCFEB91F1A467","FEC3451C7EDE0"],"fact_inventory_hash":"b6be396149f46a02e741453b5872e39745cf364180c4c6b99828083fad0d4dce","location_map":{"F36561BC1509E":{"text":{"end":1862,"kind":"utf8_span","start":1591},"visual":[{"kind":"image_primitive","primitive_id":"log-record-0"}]},"F380F1144B7BD":{"text":{"end":1015,"kind":"utf8_span","start":725},"visual":[{"kind":"image_primitive","primitive_id":"log-record-0"}]},"F7F3708927892":{"text":{"end":2408,"kind":"utf8_span","start":2134},"visual":[{"kind":"image_primitive","primitive_id":"log-record-0"}]},"F96789C510925":{"text":{"end":2134,"kind":"utf8_span","start":1862},"visual":[{"kind":"image_primitive","primitive_id":"log-record-0"}]},"FBB2A339E6F82":{"text":{"end":1591,"kind":"utf8_span","start":1299},"visual":[{"kind":"image_primitive","primitive_id":"log-record-0"}]},"FCFEB91F1A467":{"text":{"end":1299,"kind":"utf8_span","start":1015},"visual":[{"kind":"image_primitive","primitive_id":"log-record-0"}]},"FEC3451C7EDE0":{"text":{"end":725,"kind":"utf8_span","start":430},"visual":[{"kind":"image_primitive","primitive_id":"log-record-0"}]}}},"text":{"artifact_sha256":"096d903d29b93f8fadab20c571eced5dd9db02b75da63ae2b27a4cdf596292ec","fact_ids":["F36561BC1509E","F380F1144B7BD","F7F3708927892","F96789C510925","FBB2A339E6F82","FCFEB91F1A467","FEC3451C7EDE0"],"fact_inventory_hash":"b6be396149f46a02e741453b5872e39745cf364180c4c6b99828083fad0d4dce","location_map":{"F36561BC1509E":{"end":1862,"kind":"utf8_span","start":1591},"F380F1144B7BD":{"end":1015,"kind":"utf8_span","start":725},"F7F3708927892":{"end":2408,"kind":"utf8_span","start":2134},"F96789C510925":{"end":2134,"kind":"utf8_span","start":1862},"FBB2A339E6F82":{"end":1591,"kind":"utf8_span","start":1299},"FCFEB91F1A467":{"end":1299,"kind":"utf8_span","start":1015},"FEC3451C7EDE0":{"end":725,"kind":"utf8_span","start":430}}},"visual":{"artifact_sha256":"5f33c027a2cb30ff86f336ab36f135ded6d19299bde6fb3a8a742529583c49f0","fact_ids":["F36561BC1509E","F380F1144B7BD","F7F3708927892","F96789C510925","FBB2A339E6F82","FCFEB91F1A467","FEC3451C7EDE0"],"fact_inventory_hash":"b6be396149f46a02e741453b5872e39745cf364180c4c6b99828083fad0d4dce","location_map":{"F36561BC1509E":[{"kind":"image_primitive","primitive_id":"log-record-0"}],"F380F1144B7BD":[{"kind":"image_primitive","primitive_id":"log-record-0"}],"F7F3708927892":[{"kind":"image_primitive","primitive_id":"log-record-0"}],"F96789C510925":[{"kind":"image_primitive","primitive_id":"log-record-0"}],"FBB2A339E6F82":[{"kind":"image_primitive","primitive_id":"log-record-0"}],"FCFEB91F1A467":[{"kind":"image_primitive","primitive_id":"log-record-0"}],"FEC3451C7EDE0":[{"kind":"image_primitive","primitive_id":"log-record-0"}]}}},"fact_count":7,"fact_inventory_hash":"b6be396149f46a02e741453b5872e39745cf364180c4c6b99828083fad0d4dce","failures":[],"leakage_ok":true,"parity_ok":true,"prompt_composition":{"a_sha256":"a9a5e603eec48b8317fc2706c71d81109228bec55ec1c69b03903602a2530534","b_sha256":"ff4d95218d58d49a4bb1b70d021a3f027ca9666019276793e17e9b1eede64513","exact_part_concatenation":true,"hybrid_sha256":"209d544d539225122b8a51fd6c8a68cecbe60963a7fef588e72564b4bbca5dbe","order":"A_PLUS_B"},"query_hash":"d3ca21b59fa04d1897153038408304e9de257bc9a195af5fb714b9d2b9b119e8","query_id":"Q-4661E0DD5A970495","schema_version":"PairedViewAuditV1"}
