{"arms":{"bounded_hybrid":{"artifact_sha256":"d2250053c5e3f0a49c05d29e9d578b320f4ba702fcc31ee3d5cb79a00f3949db","fact_ids":["F10B11C9A1F85","F11BEA045DEA3","F4775AAFE1B9B","F98722977DD42","F9C75E7530D28","FF6BF9A522A35","FF6F9F4A0D8A8"],"fact_inventory_hash":"fda740e8a755aa63223e739600b7a31384ac03a78d722ae3254b2249355c290b","location_map":{"F10B11C9A1F85":{"text":{"end":1334,"kind":"utf8_span","start":1042},"visual":[{"kind":"image_primitive","primitive_id":"log-record-0"}]},"F11BEA045DEA3":{"text":{"end":2479,"kind":"utf8_span","start":2191},"visual":[{"kind":"image_primitive","primitive_id":"log-record-0"}]},"F4775AAFE1B9B":{"text":{"end":1911,"kind":"utf8_span","start":1633},"visual":[{"kind":"image_primitive","primitive_id":"log-record-0"}]},"F98722977DD42":{"text":{"end":1633,"kind":"utf8_span","start":1334},"visual":[{"kind":"image_primitive","primitive_id":"log-record-0"}]},"F9C75E7530D28":{"text":{"end":2191,"kind":"utf8_span","start":1911},"visual":[{"kind":"image_primitive","primitive_id":"log-record-0"}]},"FF6BF9A522A35":{"text":{"end":1042,"kind":"utf8_span","start":732},"visual":[{"kind":"image_primitive","primitive_id":"log-record-0"}]},"FF6F9F4A0D8A8":{"text":{"end":732,"kind":"utf8_span","start":430},"visual":[{"kind":"image_primitive","primitive_id":"log-record-0"}]}}},"text":{"artifact_sha256":"ff169315fdbefb43dc6d3108f394fb0f042d7c015855d31316c5a32c865ba52b","fact_ids":["F10B11C9A1F85","F11BEA045DEA3","F4775AAFE1B9B","F98722977DD42","F9C75E7530D28","FF6BF9A522A35","FF6F9F4A0D8A8"],"fact_inventory_hash":"fda740e8a755aa63223e739600b7a31384ac03a78d722ae3254b2249355c290b","location_map":{"F10B11C9A1F85":{"end":1334,"kind":"utf8_span","start":1042},"F11BEA045DEA3":{"end":2479,"kind":"utf8_span","start":2191},"F4775AAFE1B9B":{"end":1911,"kind":"utf8_span","start":1633},"F98722977DD42":{"end":1633,"kind":"utf8_span","start":1334},"F9C75E7530D28":{"end":2191,"kind":"utf8_span","start":1911},"FF6BF9A522A35":{"end":1042,"kind":"utf8_span","start":732},"FF6F9F4A0D8A8":{"end":732,"kind":"utf8_span","start":430}}},"visual":{"artifact_sha256":"6b2c5dd8bad3cbb53ac8494e7d31d6fdf98e9fff0806cacea80af3d7430383d6","fact_ids":["F10B11C9A1F85","F11BEA045DEA3","F4775AAFE1B9B","F98722977DD42","F9C75E7530D28","FF6BF9A522A35","FF6F9F4A0D8A8"],"fact_inventory_hash":"fda740e8a755aa63223e739600b7a31384ac03a78d722ae3254b2249355c290b","location_map":{"F10B11C9A1F85":[{"kind":"image_primitive","primitive_id":"log-record-0"}],"F11BEA045DEA3":[{"kind":"image_primitive","primitive_id":"log-record-0"}],"F4775AAFE1B9B":[{"kind":"image_primitive","primitive_id":"log-record-0"}],"F98722977DD42":[{"kind":"image_primitive","primitive_id":"log-record-0"}],"F9C75E7530D28":[{"kind":"image_primitive","primitive_id":"log-record-0"}],"FF6BF9A522A35":[{"kind":"image_primitive","primitive_id":"log-record-0"}],"FF6F9F4A0D8A8":[{"kind":"image_primitive","primitive_id":"log-record-0"}]}}},"fact_count":7,"fact_inventory_hash":"fda740e8a755aa63223e739600b7a31384ac03a78d722ae3254b2249355c290b","failures":[],"leakage_ok":true,"parity_ok":true,"prompt_composition":{"a_sha256":"4b742dbe5b75e43ca0c65e78ac4c495de5c04f99b63fb03a47c5c94d0d37c69b","b_sha256":"5af2d5f7b21dca1f9ccb5b8759235f4e8491f067be40ef18644d3b04698664b4","exact_part_concatenation":true,"hybrid_sha256":"d2250053c5e3f0a49c05d29e9d578b320f4ba702fcc31ee3d5cb79a00f3949db","order":"A_PLUS_B"},"query_hash":"40dddb16cd627c4fda7ffb355b4cf9c63ec6ac38d0dbb80ef72f444960b37da3","query_id":"Q-14DCDF856BEF25B5","schema_version":"PairedViewAuditV1"}
