{"arms":{"bounded_hybrid":{"artifact_sha256":"0ecb326bb6d6b11a3ba9c0af3d9042ea32c51b4e182c2e45681cb463c247cd57","fact_ids":["F41DEDC3A454A","F485B9C9A2590","F6FD6259BD94B","F85A22B8031E2","F9197AE963D92","F9A07422040E9","FA3A6FB4C8F53","FAECB65367815","FAFF6A0D4D554","FB802BEC3F9AA","FBDFEBD869391","FCAC3F2993FD6","FD286B1D1C360","FDE120B7E372D","FE3C7398AB997","FEE52ECAA58C0"],"fact_inventory_hash":"c02236a86ab8835fd01e8b4e5bba2e30f53654dfacc9ec0cf035ca13fddc8d28","location_map":{"F41DEDC3A454A":{"text":{"end":2795,"kind":"utf8_span","start":2643},"visual":[{"kind":"image_primitive","primitive_id":"temporal-4"}]},"F485B9C9A2590":{"text":{"end":1603,"kind":"utf8_span","start":1467},"visual":[{"kind":"image_primitive","primitive_id":"temporal-2"}]},"F6FD6259BD94B":{"text":{"end":2643,"kind":"utf8_span","start":2486},"visual":[{"kind":"image_primitive","primitive_id":"temporal-4"}]},"F85A22B8031E2":{"text":{"end":2175,"kind":"utf8_span","start":2039},"visual":[{"kind":"image_primitive","primitive_id":"temporal-3"}]},"F9197AE963D92":{"text":{"end":1890,"kind":"utf8_span","start":1757},"visual":[{"kind":"image_primitive","primitive_id":"temporal-3"}]},"F9A07422040E9":{"text":{"end":733,"kind":"utf8_span","start":596},"visual":[{"kind":"image_primitive","primitive_id":"temporal-0"}]},"FA3A6FB4C8F53":{"text":{"end":2345,"kind":"utf8_span","start":2175},"visual":[{"kind":"image_primitive","primitive_id":"temporal-4"}]},"FAECB65367815":{"text":{"end":1467,"kind":"utf8_span","start":1318},"visual":[{"kind":"image_primitive","primitive_id":"temporal-2"}]},"FAFF6A0D4D554":{"text":{"end":1757,"kind":"utf8_span","start":1603},"visual":[{"kind":"image_primitive","primitive_id":"temporal-3"}]},"FB802BEC3F9AA":{"text":{"end":2486,"kind":"utf8_span","start":2345},"visual":[{"kind":"image_primitive","primitive_id":"temporal-4"}]},"FBDFEBD869391":{"text":{"end":596,"kind":"utf8_span","start":430},"visual":[{"kind":"image_primitive","primitive_id":"temporal-0"}]},"FCAC3F2993FD6":{"text":{"end":1318,"kind":"utf8_span","start":1185},"visual":[{"kind":"image_primitive","primitive_id":"temporal-2"}]},"FD286B1D1C360":{"text":{"end":1185,"kind":"utf8_span","start":1031},"visual":[{"kind":"image_primitive","primitive_id":"temporal-2"}]},"FDE120B7E372D":{"text":{"end":1031,"kind":"utf8_span","start":887},"visual":[{"kind":"image_primitive","primitive_id":"temporal-0"}]},"FE3C7398AB997":{"text":{"end":2039,"kind":"utf8_span","start":1890},"visual":[{"kind":"image_primitive","primitive_id":"temporal-3"}]},"FEE52ECAA58C0":{"text":{"end":887,"kind":"utf8_span","start":733},"visual":[{"kind":"image_primitive","primitive_id":"temporal-0"}]}}},"text":{"artifact_sha256":"f6620e1bb2a5157f675eb868367cd5256ff59e98c95d56c130b41e8ed0343e1e","fact_ids":["F41DEDC3A454A","F485B9C9A2590","F6FD6259BD94B","F85A22B8031E2","F9197AE963D92","F9A07422040E9","FA3A6FB4C8F53","FAECB65367815","FAFF6A0D4D554","FB802BEC3F9AA","FBDFEBD869391","FCAC3F2993FD6","FD286B1D1C360","FDE120B7E372D","FE3C7398AB997","FEE52ECAA58C0"],"fact_inventory_hash":"c02236a86ab8835fd01e8b4e5bba2e30f53654dfacc9ec0cf035ca13fddc8d28","location_map":{"F41DEDC3A454A":{"end":2795,"kind":"utf8_span","start":2643},"F485B9C9A2590":{"end":1603,"kind":"utf8_span","start":1467},"F6FD6259BD94B":{"end":2643,"kind":"utf8_span","start":2486},"F85A22B8031E2":{"end":2175,"kind":"utf8_span","start":2039},"F9197AE963D92":{"end":1890,"kind":"utf8_span","start":1757},"F9A07422040E9":{"end":733,"kind":"utf8_span","start":596},"FA3A6FB4C8F53":{"end":2345,"kind":"utf8_span","start":2175},"FAECB65367815":{"end":1467,"kind":"utf8_span","start":1318},"FAFF6A0D4D554":{"end":1757,"kind":"utf8_span","start":1603},"FB802BEC3F9AA":{"end":2486,"kind":"utf8_span","start":2345},"FBDFEBD869391":{"end":596,"kind":"utf8_span","start":430},"FCAC3F2993FD6":{"end":1318,"kind":"utf8_span","start":1185},"FD286B1D1C360":{"end":1185,"kind":"utf8_span","start":1031},"FDE120B7E372D":{"end":1031,"kind":"utf8_span","start":887},"FE3C7398AB997":{"end":2039,"kind":"utf8_span","start":1890},"FEE52ECAA58C0":{"end":887,"kind":"utf8_span","start":733}}},"visual":{"artifact_sha256":"949cc3e6139b108063a424d0f157d640251f832e2f999cb7497d30815e343e53","fact_ids":["F41DEDC3A454A","F485B9C9A2590","F6FD6259BD94B","F85A22B8031E2","F9197AE963D92","F9A07422040E9","FA3A6FB4C8F53","FAECB65367815","FAFF6A0D4D554","FB802BEC3F9AA","FBDFEBD869391","FCAC3F2993FD6","FD286B1D1C360","FDE120B7E372D","FE3C7398AB997","FEE52ECAA58C0"],"fact_inventory_hash":"c02236a86ab8835fd01e8b4e5bba2e30f53654dfacc9ec0cf035ca13fddc8d28","location_map":{"F41DEDC3A454A":[{"kind":"image_primitive","primitive_id":"temporal-4"}],"F485B9C9A2590":[{"kind":"image_primitive","primitive_id":"temporal-2"}],"F6FD6259BD94B":[{"kind":"image_primitive","primitive_id":"temporal-4"}],"F85A22B8031E2":[{"kind":"image_primitive","primitive_id":"temporal-3"}],"F9197AE963D92":[{"kind":"image_primitive","primitive_id":"temporal-3"}],"F9A07422040E9":[{"kind":"image_primitive","primitive_id":"temporal-0"}],"FA3A6FB4C8F53":[{"kind":"image_primitive","primitive_id":"temporal-4"}],"FAECB65367815":[{"kind":"image_primitive","primitive_id":"temporal-2"}],"FAFF6A0D4D554":[{"kind":"image_primitive","primitive_id":"temporal-3"}],"FB802BEC3F9AA":[{"kind":"image_primitive","primitive_id":"temporal-4"}],"FBDFEBD869391":[{"kind":"image_primitive","primitive_id":"temporal-0"}],"FCAC3F2993FD6":[{"kind":"image_primitive","primitive_id":"temporal-2"}],"FD286B1D1C360":[{"kind":"image_primitive","primitive_id":"temporal-2"}],"FDE120B7E372D":[{"kind":"image_primitive","primitive_id":"temporal-0"}],"FE3C7398AB997":[{"kind":"image_primitive","primitive_id":"temporal-3"}],"FEE52ECAA58C0":[{"kind":"image_primitive","primitive_id":"temporal-0"}]}}},"fact_count":16,"fact_inventory_hash":"c02236a86ab8835fd01e8b4e5bba2e30f53654dfacc9ec0cf035ca13fddc8d28","failures":[],"leakage_ok":true,"parity_ok":true,"prompt_composition":{"a_sha256":"3b75b4fccbed576f2d765b5e37bd74f1a2a1963db6f5172c461df3970d94ce79","b_sha256":"436d533b558166875e4023c99e0fccc8ff72a49982dce3bc8d8c98cfd459e3b6","exact_part_concatenation":true,"hybrid_sha256":"0ecb326bb6d6b11a3ba9c0af3d9042ea32c51b4e182c2e45681cb463c247cd57","order":"A_PLUS_B"},"query_hash":"ff595230b52431177160f072c1ebeae78d39ed222264f6905d2e0e760fdc0de7","query_id":"Q-F419B458E808A86A","schema_version":"PairedViewAuditV1"}
