{"arms":{"bounded_hybrid":{"artifact_sha256":"2a33794e7afa2849843aa54319d2c815ec92ad3750712e9682690631315d1dc9","fact_ids":["F001E0A30FFFA","F1097EE5EF297","F19EBAAC29759","F354D58B3B513","F85F8D3B0065D","F92100A1BD165","F9D85097B9076","FB8A4DE176716"],"fact_inventory_hash":"8380685715791d84169c8bd338d3c9b15b5210db0008bdf5ba85e5762ef6e2be","location_map":{"F001E0A30FFFA":{"text":{"end":1920,"kind":"utf8_span","start":1735},"visual":[{"kind":"image_primitive","primitive_id":"edge-frontend-shippingservice"}]},"F1097EE5EF297":{"text":{"end":799,"kind":"utf8_span","start":621},"visual":[{"kind":"image_primitive","primitive_id":"edge-cartservice-redis"}]},"F19EBAAC29759":{"text":{"end":1544,"kind":"utf8_span","start":1353},"visual":[{"kind":"image_primitive","primitive_id":"edge-frontend-productcatalogservice"}]},"F354D58B3B513":{"text":{"end":1353,"kind":"utf8_span","start":1168},"visual":[{"kind":"image_primitive","primitive_id":"edge-frontend-checkoutservice"}]},"F85F8D3B0065D":{"text":{"end":987,"kind":"utf8_span","start":799},"visual":[{"kind":"image_primitive","primitive_id":"edge-checkoutservice-cartservice"}]},"F92100A1BD165":{"text":{"end":1168,"kind":"utf8_span","start":987},"visual":[{"kind":"image_primitive","primitive_id":"edge-frontend-cartservice"}]},"F9D85097B9076":{"text":{"end":621,"kind":"utf8_span","start":430},"visual":[{"kind":"image_primitive","primitive_id":"path-F9D85097B9076"}]},"FB8A4DE176716":{"text":{"end":1735,"kind":"utf8_span","start":1544},"visual":[{"kind":"image_primitive","primitive_id":"edge-frontend-recommendationservice"}]}}},"text":{"artifact_sha256":"140cc087a82a1a965a2bb1eea203ed4983074eeab0b87658708b212564ddfeed","fact_ids":["F001E0A30FFFA","F1097EE5EF297","F19EBAAC29759","F354D58B3B513","F85F8D3B0065D","F92100A1BD165","F9D85097B9076","FB8A4DE176716"],"fact_inventory_hash":"8380685715791d84169c8bd338d3c9b15b5210db0008bdf5ba85e5762ef6e2be","location_map":{"F001E0A30FFFA":{"end":1920,"kind":"utf8_span","start":1735},"F1097EE5EF297":{"end":799,"kind":"utf8_span","start":621},"F19EBAAC29759":{"end":1544,"kind":"utf8_span","start":1353},"F354D58B3B513":{"end":1353,"kind":"utf8_span","start":1168},"F85F8D3B0065D":{"end":987,"kind":"utf8_span","start":799},"F92100A1BD165":{"end":1168,"kind":"utf8_span","start":987},"F9D85097B9076":{"end":621,"kind":"utf8_span","start":430},"FB8A4DE176716":{"end":1735,"kind":"utf8_span","start":1544}}},"visual":{"artifact_sha256":"05d538ac5919a2269a2b4b04524461c7de1304af7420ad6a9fff5fde6bcad339","fact_ids":["F001E0A30FFFA","F1097EE5EF297","F19EBAAC29759","F354D58B3B513","F85F8D3B0065D","F92100A1BD165","F9D85097B9076","FB8A4DE176716"],"fact_inventory_hash":"8380685715791d84169c8bd338d3c9b15b5210db0008bdf5ba85e5762ef6e2be","location_map":{"F001E0A30FFFA":[{"kind":"image_primitive","primitive_id":"edge-frontend-shippingservice"}],"F1097EE5EF297":[{"kind":"image_primitive","primitive_id":"edge-cartservice-redis"}],"F19EBAAC29759":[{"kind":"image_primitive","primitive_id":"edge-frontend-productcatalogservice"}],"F354D58B3B513":[{"kind":"image_primitive","primitive_id":"edge-frontend-checkoutservice"}],"F85F8D3B0065D":[{"kind":"image_primitive","primitive_id":"edge-checkoutservice-cartservice"}],"F92100A1BD165":[{"kind":"image_primitive","primitive_id":"edge-frontend-cartservice"}],"F9D85097B9076":[{"kind":"image_primitive","primitive_id":"path-F9D85097B9076"}],"FB8A4DE176716":[{"kind":"image_primitive","primitive_id":"edge-frontend-recommendationservice"}]}}},"fact_count":8,"fact_inventory_hash":"8380685715791d84169c8bd338d3c9b15b5210db0008bdf5ba85e5762ef6e2be","failures":[],"leakage_ok":true,"parity_ok":true,"prompt_composition":{"a_sha256":"ed604dd66a009b409345734aca2f496a6ced621cac25ad05262c156011c1c26c","b_sha256":"ad788484e770352f9aae8fb8c53927ef3296f07bdca6b617ed6c5f5a0748ecb4","exact_part_concatenation":true,"hybrid_sha256":"2a33794e7afa2849843aa54319d2c815ec92ad3750712e9682690631315d1dc9","order":"A_PLUS_B"},"query_hash":"09ac67ee958aafdb0f48351715c8ac87dc01be91bd4df2a0930c60bc8f307c00","query_id":"Q-060188496D73DEA5","schema_version":"PairedViewAuditV1"}
