{"arms":{"bounded_hybrid":{"artifact_sha256":"cd87820ddf184a6455fb4e61282108db4feca63ce9fc1de04c47f0877e9be792","fact_ids":["F0363980C0F0E","F10E3837318A7","F14D6092883A5","F31FFB3010D8B","F35B50B62C4F1","F69E82CEBD854","F6EFCFA4F4C24","F8013BE8AFF83","F96B5DE03BDB8","FA5FC76A29E1C","FC4CF370F9EE0"],"fact_inventory_hash":"80304d668ea4dc26ef5f0ada4277136981f9e9920f555e18665ec545acc1fd4a","location_map":{"F0363980C0F0E":{"text":{"end":1052,"kind":"utf8_span","start":850},"visual":[{"kind":"image_primitive","primitive_id":"edge-checkoutservice-0-productcatalogservice-0"}]},"F10E3837318A7":{"text":{"end":1615,"kind":"utf8_span","start":1424},"visual":[{"kind":"image_primitive","primitive_id":"edge-frontend2-0-checkoutservice2-0"}]},"F14D6092883A5":{"text":{"end":850,"kind":"utf8_span","start":655},"visual":[{"kind":"image_primitive","primitive_id":"edge-frontend-2-productcatalogservice-0"}]},"F31FFB3010D8B":{"text":{"end":2391,"kind":"utf8_span","start":2200},"visual":[{"kind":"image_primitive","primitive_id":"edge-frontend2-0-shippingservice2-0"}]},"F35B50B62C4F1":{"text":{"end":1237,"kind":"utf8_span","start":1052},"visual":[{"kind":"image_primitive","primitive_id":"edge-frontend2-0-adservice2-0"}]},"F69E82CEBD854":{"text":{"end":2003,"kind":"utf8_span","start":1806},"visual":[{"kind":"image_primitive","primitive_id":"edge-frontend2-0-productcatalogservice2-0"}]},"F6EFCFA4F4C24":{"text":{"end":1424,"kind":"utf8_span","start":1237},"visual":[{"kind":"image_primitive","primitive_id":"edge-frontend2-0-cartservice2-0"}]},"F8013BE8AFF83":{"text":{"end":2600,"kind":"utf8_span","start":2391},"visual":[{"kind":"image_primitive","primitive_id":"edge-recommendationservice2-0-productcatalogservice-0"}]},"F96B5DE03BDB8":{"text":{"end":655,"kind":"utf8_span","start":430},"visual":[{"kind":"image_primitive","primitive_id":"path-F96B5DE03BDB8"}]},"FA5FC76A29E1C":{"text":{"end":2200,"kind":"utf8_span","start":2003},"visual":[{"kind":"image_primitive","primitive_id":"edge-frontend2-0-recommendationservice2-0"}]},"FC4CF370F9EE0":{"text":{"end":1806,"kind":"utf8_span","start":1615},"visual":[{"kind":"image_primitive","primitive_id":"edge-frontend2-0-currencyservice2-0"}]}}},"text":{"artifact_sha256":"700be020e62514c06f3c33ebb922f20f2bdedb721a0680ec2dbc6570d41e7c09","fact_ids":["F0363980C0F0E","F10E3837318A7","F14D6092883A5","F31FFB3010D8B","F35B50B62C4F1","F69E82CEBD854","F6EFCFA4F4C24","F8013BE8AFF83","F96B5DE03BDB8","FA5FC76A29E1C","FC4CF370F9EE0"],"fact_inventory_hash":"80304d668ea4dc26ef5f0ada4277136981f9e9920f555e18665ec545acc1fd4a","location_map":{"F0363980C0F0E":{"end":1052,"kind":"utf8_span","start":850},"F10E3837318A7":{"end":1615,"kind":"utf8_span","start":1424},"F14D6092883A5":{"end":850,"kind":"utf8_span","start":655},"F31FFB3010D8B":{"end":2391,"kind":"utf8_span","start":2200},"F35B50B62C4F1":{"end":1237,"kind":"utf8_span","start":1052},"F69E82CEBD854":{"end":2003,"kind":"utf8_span","start":1806},"F6EFCFA4F4C24":{"end":1424,"kind":"utf8_span","start":1237},"F8013BE8AFF83":{"end":2600,"kind":"utf8_span","start":2391},"F96B5DE03BDB8":{"end":655,"kind":"utf8_span","start":430},"FA5FC76A29E1C":{"end":2200,"kind":"utf8_span","start":2003},"FC4CF370F9EE0":{"end":1806,"kind":"utf8_span","start":1615}}},"visual":{"artifact_sha256":"4856d9e0fcd7fea3a0ef52e4203fa6ec3129a5a658dc3a7ef6c94b355c5c336d","fact_ids":["F0363980C0F0E","F10E3837318A7","F14D6092883A5","F31FFB3010D8B","F35B50B62C4F1","F69E82CEBD854","F6EFCFA4F4C24","F8013BE8AFF83","F96B5DE03BDB8","FA5FC76A29E1C","FC4CF370F9EE0"],"fact_inventory_hash":"80304d668ea4dc26ef5f0ada4277136981f9e9920f555e18665ec545acc1fd4a","location_map":{"F0363980C0F0E":[{"kind":"image_primitive","primitive_id":"edge-checkoutservice-0-productcatalogservice-0"}],"F10E3837318A7":[{"kind":"image_primitive","primitive_id":"edge-frontend2-0-checkoutservice2-0"}],"F14D6092883A5":[{"kind":"image_primitive","primitive_id":"edge-frontend-2-productcatalogservice-0"}],"F31FFB3010D8B":[{"kind":"image_primitive","primitive_id":"edge-frontend2-0-shippingservice2-0"}],"F35B50B62C4F1":[{"kind":"image_primitive","primitive_id":"edge-frontend2-0-adservice2-0"}],"F69E82CEBD854":[{"kind":"image_primitive","primitive_id":"edge-frontend2-0-productcatalogservice2-0"}],"F6EFCFA4F4C24":[{"kind":"image_primitive","primitive_id":"edge-frontend2-0-cartservice2-0"}],"F8013BE8AFF83":[{"kind":"image_primitive","primitive_id":"edge-recommendationservice2-0-productcatalogservice-0"}],"F96B5DE03BDB8":[{"kind":"image_primitive","primitive_id":"path-F96B5DE03BDB8"}],"FA5FC76A29E1C":[{"kind":"image_primitive","primitive_id":"edge-frontend2-0-recommendationservice2-0"}],"FC4CF370F9EE0":[{"kind":"image_primitive","primitive_id":"edge-frontend2-0-currencyservice2-0"}]}}},"fact_count":11,"fact_inventory_hash":"80304d668ea4dc26ef5f0ada4277136981f9e9920f555e18665ec545acc1fd4a","failures":[],"leakage_ok":true,"parity_ok":true,"prompt_composition":{"a_sha256":"721ac17946394c52f32687fe5fec8a0775719598682d9c4c7702109348d44f1f","b_sha256":"863565f809c928abf242c7fbc24fd3dcc4852ea6d96e70c85ea079a94f3a8187","exact_part_concatenation":true,"hybrid_sha256":"cd87820ddf184a6455fb4e61282108db4feca63ce9fc1de04c47f0877e9be792","order":"A_PLUS_B"},"query_hash":"334a4fd63bb10c91f0a82159eedb73ac85fe91635f9441369bdd403bd5f12329","query_id":"Q-767BE3AF4AFF27DF","schema_version":"PairedViewAuditV1"}
