{"arms":{"bounded_hybrid":{"artifact_sha256":"32701269ba69981ddaf961fe22643c08c98621aba3cac70715de46c09f13db39","fact_ids":["F001E0A30FFFA","F19EBAAC29759","F29EF46014059","F354D58B3B513","F44247C261658","F92100A1BD165","FB8A4DE176716"],"fact_inventory_hash":"93781cbcb0d0032e56da5f74a97738b19041f1fd3f64cec6da19853d3890fa00","location_map":{"F001E0A30FFFA":{"text":{"end":1765,"kind":"utf8_span","start":1580},"visual":[{"kind":"image_primitive","primitive_id":"edge-frontend-shippingservice"}]},"F19EBAAC29759":{"text":{"end":1389,"kind":"utf8_span","start":1198},"visual":[{"kind":"image_primitive","primitive_id":"edge-frontend-productcatalogservice"}]},"F29EF46014059":{"text":{"end":634,"kind":"utf8_span","start":430},"visual":[{"kind":"image_primitive","primitive_id":"edge-recommendationservice-productcatalogservice"}]},"F354D58B3B513":{"text":{"end":1198,"kind":"utf8_span","start":1013},"visual":[{"kind":"image_primitive","primitive_id":"edge-frontend-checkoutservice"}]},"F44247C261658":{"text":{"end":832,"kind":"utf8_span","start":634},"visual":[{"kind":"image_primitive","primitive_id":"edge-checkoutservice-productcatalogservice"}]},"F92100A1BD165":{"text":{"end":1013,"kind":"utf8_span","start":832},"visual":[{"kind":"image_primitive","primitive_id":"edge-frontend-cartservice"}]},"FB8A4DE176716":{"text":{"end":1580,"kind":"utf8_span","start":1389},"visual":[{"kind":"image_primitive","primitive_id":"edge-frontend-recommendationservice"}]}}},"text":{"artifact_sha256":"1d83b9f2cf2dac4f7f65b535b7adc2d324678c6c613f5ebc12dad02145ac87f2","fact_ids":["F001E0A30FFFA","F19EBAAC29759","F29EF46014059","F354D58B3B513","F44247C261658","F92100A1BD165","FB8A4DE176716"],"fact_inventory_hash":"93781cbcb0d0032e56da5f74a97738b19041f1fd3f64cec6da19853d3890fa00","location_map":{"F001E0A30FFFA":{"end":1765,"kind":"utf8_span","start":1580},"F19EBAAC29759":{"end":1389,"kind":"utf8_span","start":1198},"F29EF46014059":{"end":634,"kind":"utf8_span","start":430},"F354D58B3B513":{"end":1198,"kind":"utf8_span","start":1013},"F44247C261658":{"end":832,"kind":"utf8_span","start":634},"F92100A1BD165":{"end":1013,"kind":"utf8_span","start":832},"FB8A4DE176716":{"end":1580,"kind":"utf8_span","start":1389}}},"visual":{"artifact_sha256":"ce161b369dc3588d25d640411e6b29a66c7260d3f1ca5ba8cd2a561398c9e7b8","fact_ids":["F001E0A30FFFA","F19EBAAC29759","F29EF46014059","F354D58B3B513","F44247C261658","F92100A1BD165","FB8A4DE176716"],"fact_inventory_hash":"93781cbcb0d0032e56da5f74a97738b19041f1fd3f64cec6da19853d3890fa00","location_map":{"F001E0A30FFFA":[{"kind":"image_primitive","primitive_id":"edge-frontend-shippingservice"}],"F19EBAAC29759":[{"kind":"image_primitive","primitive_id":"edge-frontend-productcatalogservice"}],"F29EF46014059":[{"kind":"image_primitive","primitive_id":"edge-recommendationservice-productcatalogservice"}],"F354D58B3B513":[{"kind":"image_primitive","primitive_id":"edge-frontend-checkoutservice"}],"F44247C261658":[{"kind":"image_primitive","primitive_id":"edge-checkoutservice-productcatalogservice"}],"F92100A1BD165":[{"kind":"image_primitive","primitive_id":"edge-frontend-cartservice"}],"FB8A4DE176716":[{"kind":"image_primitive","primitive_id":"edge-frontend-recommendationservice"}]}}},"fact_count":7,"fact_inventory_hash":"93781cbcb0d0032e56da5f74a97738b19041f1fd3f64cec6da19853d3890fa00","failures":[],"leakage_ok":true,"parity_ok":true,"prompt_composition":{"a_sha256":"13d14c92f8d7fc12cfc17e2c31a897732606f4dba9f01c98336bc6a67279f64f","b_sha256":"8c31332c1978b7bbb1a3ab1902eff6be9f7eff791ea2d0469241cb74f1e92f70","exact_part_concatenation":true,"hybrid_sha256":"32701269ba69981ddaf961fe22643c08c98621aba3cac70715de46c09f13db39","order":"A_PLUS_B"},"query_hash":"f6bb78fada2d1f0b4afd798bc03ea9e405596cb444bf3cc5b83c42f30781c390","query_id":"Q-D28163154231A781","schema_version":"PairedViewAuditV1"}
